{
  "schemaVersion": "1.0.0",
  "contractKind": "component-catalog",
  "catalogId": "catalog-id",
  "status": "draft",
  "tokenSource": {
    "docsPath": "docs/design/ui_foundations.md",
    "codePaths": [
      "Assets/Scripts/Features/Garage/Presentation/Theme/ThemeColors.cs"
    ]
  },
  "components": [
    {
      "componentId": "component-id",
      "level": "atom",
      "role": "action",
      "states": [
        "default"
      ],
      "slots": [],
      "childComponents": [],
      "tokenRefs": [
        "text/primary"
      ],
      "unityBasePrefab": "Assets/Prefabs/Shared/UI/Atoms/ComponentName.prefab",
      "intendedUses": [
        "intended-use"
      ],
      "notes": []
    }
  ],
  "notes": []
}
